{
  "status": "pass",
  "coverage_percent": 100,
  "evidence_rows": [
    {
      "anomaly_id": "DUP-001",
      "record_ids": ["R900001", "R900002"],
      "citations": [
        {"doc_id": "01_expense_reimbursement_2025.md", "clause_no": "第十条"}
      ],
      "facts": [
        "R900001于2025-01-05提交办公用品报销480.00元，发票号FPDEV900001，状态已批准。",
        "R900002于2025-01-06提交办公用品报销480.00元，发票号FPDEV900001，状态已批准。",
        "两张报销单使用同一发票FPDEV900001，发票日期2025-01-05，发票金额480.00元，供应商开发供应商01。",
        "两笔报销均由同一员工E9001（开发员工甲）提交，均经部门经理E9002审批通过。"
      ],
      "fact_supported": true,
      "rule_supported": true,
      "coverage_status": "pass"
    }
  ],
  "candidate_record_ids": ["R900001", "R900002"],
  "submitted_record_ids": ["R900001", "R900002"],
  "unowned_record_ids": [],
  "unused_candidate_record_ids": [],
  "unused_citations": [],
  "missing_evidence": [],
  "no_anomaly_coverage": {
    "complete": false
  },
  "reconciled_figures": {
    "invoice_fpdev900001_usage_count": 2,
    "total_amount": 960.0,
    "single_invoice_amount": 480.0
  },
  "unresolved_items": []
}
