{
  "candidate_record_ids": [],
  "coverage_percent": 100,
  "evidence_rows": [],
  "missing_evidence": [],
  "no_anomaly_coverage": {
    "checked_rules": [],
    "complete": true,
    "conclusion": "无异常。此为制度版本适用性判断，不涉及具体费用记录异常。2025修订版为现行有效制度，2022版已废止。部门总经理审批线出自《授权管理办法》附件二AR-03档位（≥10000元且<50000元）。",
    "population_count": 3,
    "query_conditions": "检索条件：policy_query.search_policy '费用报销审批 部门总经理 2022 2025 修订'；完整读取doc_id=01_expense_reimbursement_2025.md、02_expense_reimbursement_2022_deprecated.md、03_authorization_management.md",
    "searched_population": "XX证券费用报销管理办法（2022版与2025修订版）及XX证券授权管理办法附件二"
  },
  "reconciled_figures": {},
  "status": "pass",
  "submitted_record_ids": [],
  "unowned_record_ids": [],
  "unresolved_items": [],
  "unused_candidate_record_ids": [],
  "unused_citations": []
}
