{
  "status": "pass",
  "coverage_percent": 100,
  "evidence_rows": [
    {
      "anomaly_id": "ANOM-D902-001",
      "record_ids": ["R900019"],
      "citations": [
        {"doc_id": "01_expense_reimbursement_2025.md", "clause_no": "第十三条"},
        {"doc_id": "08_budget_management.md", "clause_no": "第三条"},
        {"doc_id": "08_budget_management.md", "clause_no": "第四条"}
      ],
      "facts": [
        "D902部门2025年度预算为50,000元",
        "R900018报销45,000元（2025-01-15），累计45,000元，未超过预算",
        "R900019报销6,000元（2025-02-15），累计51,000元，首次超过预算额度50,000元（达到1.02倍）",
        "R900019的special_approval字段为0，未履行专项审批",
        "R900020报销5,000元（2025-03-15），累计56,000元，但special_approval字段为1，已履行专项审批，属于有效豁免"
      ],
      "fact_supported": true,
      "rule_supported": true,
      "coverage_status": "pass"
    }
  ],
  "candidate_record_ids": ["R900019"],
  "submitted_record_ids": ["R900019"],
  "unowned_record_ids": [],
  "unused_candidate_record_ids": [],
  "unused_citations": [],
  "missing_evidence": [],
  "no_anomaly_coverage": {
    "complete": false
  },
  "reconciled_figures": {
    "department_budget": 50000,
    "cumulative_approved": 56000,
    "record_count": 3
  },
  "unresolved_items": []
}
