{
  "status": "pass",
  "coverage_percent": 100,
  "evidence_rows": [
    {
      "anomaly_id": "DEV-002-ANOM-001",
      "record_ids": ["R900016"],
      "citations": [
        {"doc_id": "05_training_expense.md", "clause_no": "第三条"},
        {"doc_id": "05_training_expense.md", "clause_no": "第四条"}
      ],
      "facts": [
        "R900016：开发员工甲，2025-08-02，内部培训综合费用一天，报销金额850元",
        "《XX证券培训费管理办法》第三条：内部培训综合费用每日不超过800元",
        "850元 > 800元，超出每日上限50元"
      ],
      "fact_supported": true,
      "rule_supported": true,
      "coverage_status": "pass"
    }
  ],
  "candidate_record_ids": ["R900016"],
  "submitted_record_ids": ["R900016"],
  "unowned_record_ids": [],
  "unused_candidate_record_ids": [],
  "unused_citations": [],
  "missing_evidence": [],
  "no_anomaly_coverage": {
    "complete": false
  },
  "reconciled_figures": {
    "内部培训每日上限": "800元",
    "外部培训每日上限": "1200元",
    "R900016实际金额": "850元",
    "R900016超出上限": "50元"
  },
  "unresolved_items": []
}
