{
  "candidate_record_ids": [
    "R001388",
    "R002655",
    "R001290",
    "R002856",
    "R001560",
    "R001842"
  ],
  "coverage_percent": 100,
  "evidence_rows": [
    {
      "anomaly_id": "ANO-L3-004-001",
      "citations": [
        {
          "clause_no": "第二条",
          "doc_id": "08_budget_management.md"
        },
        {
          "clause_no": "第三条",
          "doc_id": "08_budget_management.md"
        },
        {
          "clause_no": "第四条",
          "doc_id": "08_budget_management.md"
        },
        {
          "clause_no": "第十三条",
          "doc_id": "01_expense_reimbursement_2025.md"
        }
      ],
      "coverage_status": "pass",
      "fact_supported": true,
      "facts": [
        "department_id",
        "department_name",
        "annual_budget",
        "crossing_record_id",
        "crossing_amount",
        "reimburse_date",
        "special_approval",
        "cumulative_before",
        "cumulative_after"
      ],
      "record_ids": [
        "R001388"
      ],
      "rule_supported": true
    },
    {
      "anomaly_id": "ANO-L3-004-002",
      "citations": [
        {
          "clause_no": "第二条",
          "doc_id": "08_budget_management.md"
        },
        {
          "clause_no": "第三条",
          "doc_id": "08_budget_management.md"
        },
        {
          "clause_no": "第四条",
          "doc_id": "08_budget_management.md"
        },
        {
          "clause_no": "第十三条",
          "doc_id": "01_expense_reimbursement_2025.md"
        }
      ],
      "coverage_status": "pass",
      "fact_supported": true,
      "facts": [
        "department_id",
        "department_name",
        "annual_budget",
        "crossing_record_id",
        "crossing_amount",
        "reimburse_date",
        "special_approval",
        "cumulative_before",
        "cumulative_after"
      ],
      "record_ids": [
        "R002655"
      ],
      "rule_supported": true
    },
    {
      "anomaly_id": "ANO-L3-004-003",
      "citations": [
        {
          "clause_no": "第二条",
          "doc_id": "08_budget_management.md"
        },
        {
          "clause_no": "第三条",
          "doc_id": "08_budget_management.md"
        },
        {
          "clause_no": "第四条",
          "doc_id": "08_budget_management.md"
        },
        {
          "clause_no": "第十三条",
          "doc_id": "01_expense_reimbursement_2025.md"
        }
      ],
      "coverage_status": "pass",
      "fact_supported": true,
      "facts": [
        "department_id",
        "department_name",
        "annual_budget",
        "crossing_record_id",
        "crossing_amount",
        "reimburse_date",
        "special_approval",
        "cumulative_before",
        "cumulative_after"
      ],
      "record_ids": [
        "R001290"
      ],
      "rule_supported": true
    },
    {
      "anomaly_id": "ANO-L3-004-004",
      "citations": [
        {
          "clause_no": "第二条",
          "doc_id": "08_budget_management.md"
        },
        {
          "clause_no": "第三条",
          "doc_id": "08_budget_management.md"
        },
        {
          "clause_no": "第四条",
          "doc_id": "08_budget_management.md"
        },
        {
          "clause_no": "第十三条",
          "doc_id": "01_expense_reimbursement_2025.md"
        }
      ],
      "coverage_status": "pass",
      "fact_supported": true,
      "facts": [
        "department_id",
        "department_name",
        "annual_budget",
        "crossing_record_id",
        "crossing_amount",
        "reimburse_date",
        "special_approval",
        "cumulative_before",
        "cumulative_after"
      ],
      "record_ids": [
        "R002856"
      ],
      "rule_supported": true
    },
    {
      "anomaly_id": "ANO-L3-004-005",
      "citations": [
        {
          "clause_no": "第二条",
          "doc_id": "08_budget_management.md"
        },
        {
          "clause_no": "第三条",
          "doc_id": "08_budget_management.md"
        },
        {
          "clause_no": "第四条",
          "doc_id": "08_budget_management.md"
        },
        {
          "clause_no": "第十三条",
          "doc_id": "01_expense_reimbursement_2025.md"
        }
      ],
      "coverage_status": "pass",
      "fact_supported": true,
      "facts": [
        "department_id",
        "department_name",
        "annual_budget",
        "crossing_record_id",
        "crossing_amount",
        "reimburse_date",
        "special_approval",
        "cumulative_before",
        "cumulative_after"
      ],
      "record_ids": [
        "R001560"
      ],
      "rule_supported": true
    },
    {
      "anomaly_id": "ANO-L3-004-006",
      "citations": [
        {
          "clause_no": "第二条",
          "doc_id": "08_budget_management.md"
        },
        {
          "clause_no": "第三条",
          "doc_id": "08_budget_management.md"
        },
        {
          "clause_no": "第四条",
          "doc_id": "08_budget_management.md"
        },
        {
          "clause_no": "第十三条",
          "doc_id": "01_expense_reimbursement_2025.md"
        }
      ],
      "coverage_status": "pass",
      "fact_supported": true,
      "facts": [
        "department_id",
        "department_name",
        "annual_budget",
        "crossing_record_id",
        "crossing_amount",
        "reimburse_date",
        "special_approval",
        "cumulative_before",
        "cumulative_after"
      ],
      "record_ids": [
        "R001842"
      ],
      "rule_supported": true
    }
  ],
  "missing_evidence": [],
  "no_anomaly_coverage": {
    "checked_rules": [],
    "complete": false,
    "conclusion": "not_applicable",
    "population_count": 0,
    "query_conditions": "not_applicable",
    "searched_population": "not_applicable"
  },
  "reconciled_figures": {},
  "status": "pass",
  "submitted_record_ids": [
    "R001388",
    "R002655",
    "R001290",
    "R002856",
    "R001560",
    "R001842"
  ],
  "unowned_record_ids": [],
  "unresolved_items": [],
  "unused_candidate_record_ids": [],
  "unused_citations": []
}
